{
  "project_id": "opp-5",
  "name": "AI Resume Builder",
  "stage": "discovered",
  "status": "active",
  "created_at": "2026-10-10T02:35:39Z",
  "updated_at": "2026-10-10T02:35:39Z",
  "approved_stages": [],
  "artifacts": {},
  "next_action": "Manual validation trigger for issue #5",
  "last_run": null,
  "audit_log": [
    {
      "timestamp": "2026-10-10T02:35:39Z",
      "action": "project_created",
      "actor": "github-actions",
      "details": "Created from issue #5: [Opportunity] AI Resume Builder"
    }
  ]
}
